NAME,SUB,Date,Text
International_KB,AskHistorians,2015-03-10 18:18,&gt  You had commented that if ever there were any shortages of munitions at the front it could solely be attributed to the Soviets overwhelmed supply lines?  To be clear my area of knowledge tends to be the Soviet economy as a whole rather than the specifics of logistical supply during the war. So the idea that any munitions crisis was the product of supply/transportation difficulties is pure conjecture. It may just be that the volumes produced while impressive simply weren't enough to cope with the intensity of the fighting. What I can say with confidence that Soviet armaments and munition production increased each year during the war and continually outstripped Germany. To quote from Adam Tooze's *Wages of Destruction*:  &gt  If there was a true 'armaments miracle' in 1942 it occurred not in Germany but in the armaments factories in the Urals. Despite having suffered territorial losses and disruption that resulted in a 25 per cent fall in total national product the Soviet Union in 1942 managed to out-produce Germany in virtually every category of weapons. The margin for small arms and artillery was 3:1. For tanks it was a staggering 4:1 a differential compounded by the superior quality of the T34 tank. Even in combat aircraft the margin was 2:1. It was this industrial superiority contrary to every expectation that allowed the Red Army first to absorb the Wehrmacht's second great onslaught and then in November 1942 to launch a whole series of devastating counterattacks.  But this is 1942. What is more accurate is to note is that in the 'darkest days' of the second half of 1941 there was an immense demand for munitions at precisely the time that production and transport were undergoing severe strain/dislocation. This was the period in which shortages of arms would have been greatest - as entire armies were lost and the economic mobilisation was still underway. From 1942 onwards (perhaps excluding Q1) however with the war economy established the problem became the opposite - how to avoid crashing the economy through excessive mobilisation.  &gt  Taking into consideration the front lines around the time period of 1941 and 42 was most of the remaining farmland still within Soviet possession situated between the Volga and the Urals?  Not quite. The USSR was split into a six agricultural producer/consumer regions three of each. Much of the Southern Producer Region (ie the Ukraine) was lost to the Germans along with a chunk of the Central Producer Region (which included the Volga area). But the Eastern Producer Region (Siberia and most of Central Asia) was unoccupied and continued to produce. However these areas were not as naturally productive as those lands in European Russia and comprised maybe 25% of overall grain production (based on some very rough maths by me drawing on Davies' *Years of Hunger*).  That said the agricultural situation was severe. Granted the Germans had 'relieved' Moscow of about a third of its population during their advance but they'd also (deliberately) seized the prime grain producing areas. In 1942 agricultural output was a mere 40% of the pre-war level. This continued to be a severe strain on the Soviet population and economy until a recovery of sorts in 1944-45.  &gt  This is simply conjecture on my part but it almost seems as though the actions taken by Stalin in the decade prior were an absolute necessity to the future survival of the USSR and its many differing ethnic groups. I'm not an apologist for Stalin and neither do I hold Communist sympathies but I can't imagine the Soviet Union having survived the war without their reliance on the major portions of industry that had been so ruthlessly built only a decade before. Add to that purges within the government society and the military had crafted a society of people who were familiar with and capable of surviving in unimaginable circumstances. Though obviously its easy for me to hold such an opinion when I myself never experienced the difficulties of the era.  Which is a topic that I won't go into much. What I will say is that while industrialisation was an objective shared by all Bolsheviks the Stalinist form that it ultimately took during the 1930s was incredibly wasteful. I'd also question why the Soviets needed to effectively rebuild their army from scratch in 1941 - Stalin's purging and flawed pre-war deployments much surely take much of the blame for the catastrophe of Barbarossa.
Cruentum,AskHistorians,2015-03-10 19:11,I never said it was. I think it was from June 22nd to July 3rd or 4th (when Stalin made his own speech to the Soviet Union which he never did before then).           Again the mental breakdown legend comes from Chakovsky (who wasn't there) and Khrushchev (who was there). Molotov (who was there) said he didn't do it as a mental breakdown but to sort things out and had left with Malenkov while keeping in contact. So yeah it does sound like he wasn't losing it as much as Khrushchev proclaimed. 
MisterBigStuf,AskHistorians,2015-03-10 19:52,Churchill you can't be serious?
JesuIsEveryNameTaken,history,2015-03-10 20:14,How was Churchill able to rebound politically years later after such a catastrophe? 
Gettodacchopper,history,2015-03-10 21:38,The short version is that he warned about Hitler and Germany when few wanted to think about it. 
adave4allreasons,history,2015-03-10 22:17,One of the most ill-conceived plans ever.  Just like Churchill's Italian campaign.  Apparently he never understood that mountains make a difference in battle.  
macros-the-black,history,2015-03-10 23:37,Churchill had a few howlers. But his successes were more numerous. And he was old money.   It's interesting to compare this to modern politics where one mistake can cost a politician their career because of the availability of information through myriad media channels.   Churchill got away some serious missteps in judgement and went on to become what many would consider a 'great leader'. Wonder how many 'great leaders' we've missed out on because of the unforgiving nature of modern politics. 
TheChosenOne127,AskHistorians,2015-03-10 23:47,Actually Hitler was convinced that the landings was happening at Calais. It's the main reason that some panzer divisions were not in Normandy at the time of D-Day. The operation was referred to as Operation Fortitude. Things could've gone a lot worse during D-Day.
THIS_IS_SO_HILARIOUS,AskHistorians,2015-03-11 4:48,I would be very careful to use Khrushchev for source on Stalin it been known that Khrushchev is known for distorting and lying on Stalin's activity. He was a victim of the Ukraine famine himself and did sought to destroy any reputation on Stalin even with lying.
This_Is_The_End,AskHistorians,2015-03-11 5:20,I didn't knew that. I believed the relationship was solely influenced by the support for mercenaries and Poland in the Polish-Sovjet war.  At least all this together gives a nice hint why Stalin made his movements. 
Bernardito,AskHistorians,2015-03-11 5:29,Perhaps I should have been more concrete: What i meant to say is that he saw Indochina as the springboard for *every* major loss and campaign during the initial Japanese conquest. This also includes the Philippines which clearly had a very urgent relevance for Roosevelt. 
ShootingPains,AskHistorians,2015-03-11 7:58,I recall that Beevor talks about an all woman anti-tank regiment in his Stalingrad book. 
cosmitz,AskHistorians,2015-03-11 8:06,is my memory failing or did the british use the Churchill hvac there? 
eadingas,history,2015-03-11 8:29,His entire political career is a series of controversies gaffes and misjudgements. He languished on the back benches for almost a decade. If it wasn't for the WWII he'd have likely been remembered as at best an average politician  at worst - a monster (he sanctioned the use of gas on the Kurds machine guns on striking workers and expressed a desire to brutally crush Indian independence movement among other things). But his tenacity verging on cruelty proved to be just the thing needed in a world war.    Also in the general carnage and mess that was WWI British people simply didn't pay as much attention to individual actions - and Gallipolli was relatively minor loss for the British forces. Maybe if Churchill was responsible for something like the Somme he'd never bounce back again.
Georgy_K_Zhukov,AskHistorians,2015-03-11 9:00,Yeah as the Germans approached Stalingrad Soviet forces in the region were sparse so they threw just about anything with a pulse at them to delay it. '*Narodnoe Opolcheniye*' or citizen levies were utilized and saw workers from the Barrikady Ordnance Factory the Red October Steel Works and the Dzerzhinsky Tractor Factory thrown at the Germans with little real training and very underarmed.
AusHaching,AskHistorians,2015-03-11 9:06,"The timeline you mentioned is somewhat off but the story itself is true. Hitler saw the prototype on November 26. 1943. He asked if the plane could be fitted with bombs. When the company answered yes Hitler agreed on the production if the design was turned into a ""Blitzbomber"".  Numerous people within the Luftwaffe disagreed and tried to persuade Hitler to use the plane as a fighter but it took until early 1945 until the Me 262 was used in the role it had been designed for. And while it was very dangerous as an interceptor there were too few to have a real impact on the war. The main advantages were the high speed which allowed the Me 262 to outrun escort fighters and the heavy armament.  Why did Hitler act this way? First Hitler in 1944 was not a very stable person. The strain of commanding the german army for years had taken its toll and he was abusing a lot of medical products. According the statements by people in his vicinity he was prone to fits of rage and depression and was very capable of acting irrational. Many people have classified him as clinically insane by this point.   While the actual motivations will remain unknown german-language sources claim that Hitler had a large desire for revenge against the western Allies. He hoped that the Me 262 would be able to bomb England and the allied forces with impunity - even though the payload was low and the design was not optimised for bombing runs."
jonewer,AskHistorians,2015-03-11 9:21,&gt  Are the likes of John Laffin Denis Winter Alan Clark and Liddell Hart really the entire reason for the emergence of that perspective?  Haig's descent from national hero *sans pareil* to comic book super-villain is something that I have been causally looking at recently hence my recent [question](http://www.reddit.com/r/AskHistorians/comments/2ynojf/when_did_the_war_poets_like_sassoon_and_owen/) on this sub about war poets.  So after the war he was much feted with some even fearing he might turn to politics and become a Mussolini type figure.   After his death we the publication of Lloyd-George's memoirs in the 1930's which is also when people like Edmonds and Liddell-Hart start cooking up mischief. Also of published at the time is Baker-Carr's book from which the (in)famous alleged quote about Haig and machine guns is to be mined. Nevertheless Haig's reputation holds up reasonably well in the 30's.  However it's really in the 1960's where things turn bad what with the publication of books by Clarke and Taylor while 'Oh what a Lovely War' achieves considerable popularity. There are some indication that Wilfred Owen's poetry becomes very popular at around this time.  It's maybe of note that the change in how Haig and the war was viewed coincided with the loss of large chunks of the Empire as well as with the general 1960's liberal consensus.  By the time Blackadder goes forth is broadcast in 1989 many school children's only exposure to the Great War is reading Owen's poetry in English classes with History classes picking up at Versailles through to Munich...  In 1998 (80 years after Victory) the Daily Express had a headline calling for Haig's statue to be removed with Clarke advocating it be vandalised as Haig was a mass murderer.  &gt  I recognize that the ‘Butcher’ Haig angle is very much on the decline right now but I still run into more moderate versions of it regularly  For the most part the 'rehabilitationist' view of Haig is confined to those who can actually be bothered to read a history book ie. a very small section of the population.  For the most part people's reactions to Haig are very much along the lines of Donkey through War Criminal to Mass Murderer and its hard to engage with such an ingrained concept in people who frankly aren't very interested in the first place.   
throwthetrash15,AskHistorians,2015-03-11 9:35,I like the answer. And I also understand that he indeed wanted a jet powered bomber that speed past allied fighters and bomb London- eventually New York- but what I don't understand is given the Me262's track record when it first was tested in actual combat he didn't actually bring to a reasonable production level. From my understanding he believed that repelling Overlord would mean a catastrophic loss for the Allies. This would allow him to focus in the East and potentially win the war. In the book D-Day Ambrose states that the Allies needed Air SUPREMACY (which they had at a great cost) over France to succeed with D-Day Hitler knew this as well. Why did he not see that a Jet fighter at this point could potentially challenge and quickly bring the superiority to him?
AusHaching,AskHistorians,2015-03-11 9:49,The Me 262 was barely ready for frontline service in summer 1944. Even if Hitler had decided to use the Me 262 as a fighter it would not have been avaiable in large enough numbers to change the outcome of the war.   You should also consider that Germany did not have the resources or the manpower to keep building the proven piston-engined fighters and set up a completely new production for jet fighters. The numerical superiority of allied fighters was simply too large.  And - last but not least - pilots had to be trained for the new plane. A jet fighter behaves very differently to a piston-engined fighter and Germany did not have a surplus of trained pilots quite to the contrary.
sk_2013,AskHistorians,2015-03-11 9:54,I'm pretty sure he means the AVRE unless Churchill had a secret weapon centering around central air.
norhis,AskHistorians,2015-03-11 10:09,"According to ""Grunnbok i Norges Historie page 292-293"" you are correct. Quisling was the leader of a party called National Assembly Nasjonal Samling in Norwegian. On the 9th of April he proclaimed himself as the new prime minister of a government who was willing to co-operate with the Reich. The Norweigan Supreme Court did not like Quisling much. On the 15th of April they voted to assemble an Administrative Councel. On April 24 Hitler made Josef Terboven Reichkommisar. The Germans wanted to distance themselfs from Quisling in order to establish a connection with the legitimate Norwegian government instances. This was mostly so they with the cooperation of the Parliament could establish a government and work against the Norwegian Government in London.   Sources:   Helle et al. 2013. Grunnbok I Norges Historie: Fra Vikingtid Til Våre Dager. Oslo. Universitetsforlaget"
kieslowskifan,AskHistorians,2015-03-11 11:08,"The story of the Me-262's use as a bomber is somewhat convoluted and exaggerated in postwar memoirists such as Adolf Galland. In February 1943 a *Führerbefehl* decreed that all fighter aircraft should provision for bomb racks so they could be used as fighter-bombers. Willy Messerschmitt then incorporated the provision for bomb racks into the design and began development on paper for pure bomber variants of the 262.  In September 1943 Messerschmitt personally assured Hitler that the 262 could be used as a high-speed bomber over southern England.  When Hitler saw a 262 on display he inquired whether it could carry bombs and Messerschmitt again affirmed that the 262 could carry a decent bomb load. From all this Hitler got the impression that the 262 was analogous to the Ar234 a bomber that would use speed to evade enemy defenses. By January 1944 at a conference with Milch and Speer Hitler stressed that the bomb load of the 262 should be increased so when a *Jagerstab* conference on aircraft production the following May noted that the 262 was to be a fighter Hitler thought his orders were being deliberately flaunted. Milch tried to argue the case for the 262 as a fighter but Hitler would have none of it. Goering subsequently sent out a directive stating ""The Führer has ordered that the Me 262 is to be operated purely as a high-speed bomber. There is to be no mention of it as a fighter until further notice.""   So what impact did this have on the deployment of the 262? Not very much. The bomber variants of the 262 were already in development long before the May 1944 *Jagerstab* conference. The 262 program like many high-technology programs was beset by technical issues which were compounded by Germany's shortages of strategic materials.  The greatest problem for the 262 was what made it so revolutionary: its engines. The Junkers Jumo 004 selected for the 262 after its intended powerplant the  BMW 003 fell hopelessly behind schedule was a persnickety design and ersatz materials gave it a very short design life. The bugs within the engine were difficult to iron out and prevented any full-scale deployment of the 262 in early 1944.  Furthermore a shortage of trained workers and the pressures of dispersal of factories caused by Allied bombing put a ceiling on how many 262s could be produced.   The 262 as bomber entered into postwar memory as an example of Hitler's strategic myopia. Postwar Luftwaffe veterans would argue that but for the  Führer the 262 could have entered into production earlier and turned the tide of the air war. Writers such as Ambrose uncritically repeated this  line was but the reality was the 262 arguably went into service as early as it could have given the circumstances. Luftwaffe pilots also had great difficulty coming up with new tactics and formations which to use the 262 effectively. The convoluted nature of the 262's bomber interlude does indict the Third Reich on a different set of charges. The polycratic nature of the Third Reich where there were multiple centers of power all dependent upon Hitler's approval meant that German officials were inclined to try and court the Führer's opinion. Messerschmitt like many other technical experts in the aviation industry often misled or exaggerated aviation developments to suit Hitler's expectations. In the example of the 262 Willy Messerschmitt conflated paper projects for a pure 262 bomber with the emerging new design which just had bomb racks.   *Sources*  Boyne Walter J. *Messerschmitt Me 262: Arrow to the Future*. Atglen PA: Schiffer Pub 1994.   Forsyth Robert and Eddie J. Creek. *Me 262 Bomber and Reconnaissance Units*. Oxford: Osprey Pub 2012.   Uziel Daniel. *Arming the Luftwaffe: The German Aviation Industry in World War II*. Jefferson N.C.: McFarland &amp  Company 2012.   "
twodot596,history,2015-03-11 11:31,Margaret Thatcher for US President Winston Churchill for UK PM Ghengis Khan for Russian President All at the same time in present day.  I love my Brits and my Comrades in the motherland but a nice fat world war between those two and a somewhat rational and sane US president would sure make someone else the asshole for the next 50 years. And thats kinda what I want for the US. For us to stop being the asshole. 
twodot596,history,2015-03-11 11:35,The man was a drunk and definitely racist. He was a unyielding demonstration of the power of will. Winston Churchill is everything that was needed and his entire fate embodied. He **HAD** to be a stubborn iron willed bulldog. Its who he was made to be.    Not every person the world over will celebrate who he was but their lives have been impacted by his existence. 
joefurry,history,2015-03-11 11:41,"In terms of 'human history' I would say Stalingrad.   It had the most combatants and was the bloodiest battle of all time in absolute terms.  If the German's had won then it would have likely been all over for Russia. Germany would be able to take the oil in the Caucasus region and refocus efforts on taking Moscow.   As it was the Germans lost 1 million men and had no further strategic victories in the East.   Maybe the Western Allies would have beaten Germany but if Russia had fallen the war would probably seen a much heavier genocide and the Western Allies losses would have been much much higher. It's possible that they wouldn't have been able to win and the USA would have sued for peace rather than unconditional surrender.   This scenario is all laid out in the horrifying novel ""Fatherland"" by Robert Harris. "
BFGDoomer,history,2015-03-11 12:26,Stalingrad is a great choice. Very horrible battle too.
Bernardito,AskHistorians,2015-03-11 12:42,Don't be so certain that things would have gone that different. Roosevelt's thinking was in the face of reality just wishful thinking and while he kept pushing for it there was nothing stopping the French from returning to claim their colony once more in 1945.  FDR saw colonialism in pre-WWI as one of the reasons for that very war and he was also horrified by the treatment of the colonized population under the colonizers. This was also one of the reasons to why he was against the French from returning seeing their treatment of the Vietnamese as something negative.
